"The World Health Organization just admitted that I was right. Lockdowns are killing countries all over the world. The cure cannot be worse than the problem itself. Open up your states, Democrat governors. Open up New York. A long battle, but they finally did the right thing!"
Republicans should be strongly focused on completing a wonderful stimulus package for the American People!
"What’s going on, almost nobody is showing up for Sleepy Joe rallies!"
"Sleepy Joe Biden had a particularly bad day today. He couldn’t remember the name of Mitt Romney, said again he was running for the U.S. Senate, and forgot what State he was in. If I did any of this, it would be disqualifying. With him, he’s just Sleepy Joe!"
"He should sue the women, and all of those who illegally worked with them, for false and disgusting accusations!!!"
Cuomo Dodges on Whether Sending COVID Patients into Nursing Homes Was a Mistake https://breitbart.com/clips/2020/10/12/cuomo-dodges-on-whether-sending-covid-patients-into-nursing-homes-was-a-mistake/… via @BreitbartNews. He really blew it. Could have put people in Convention Center or Hospital Ship. Didn’t have a clue!!!
Leaving now for Florida Rally. Big crowds!
Leaving now for Florida Rally. Big crowds!
"Viewership for NBA Finals Finale Crash Nearly 70%, Beaten by Random Sunday Night Football Game https://breitbart.com/sports/2020/10/12/viewership-for-nba-finals-finale-crash-nearly-70-from-2019-again-beaten-by-random-sunday-night-football-game/… via @BreitbartNews Maybe they were watching in China, but I doubt it. Zero interest!"
"Joe Biden has let the Unions down — always has, always will!"
"307,000 Veterans Died waiting for Healthcare at the V.A. During Sleepy Joe Biden’s Watch. 800,000 Records Stalled! A complete and total disaster."
Heading to the Greatest Economy Of All Time!!!  VOTE
HAPPY COLUMBUS DAY TO ALL!
STOCK MARKET UP ANOTHER 300 POINTS - GREATEST LEADING INDICATOR OF THEM ALL!!! DON’T RUIN IT WITH SLEEPY JOE!!!
The Economy is about ready to go through the roof. Stock Market ready to break ALL-TIME RECORD. 401k’s incredible. New Jobs Record. Remember all of this when you VOTE. Sleepy Joe wants to quadruple your Taxes. Depression!!! Don’t let it happen! #MAGA
Republicans must state loudly and clearly that WE are going to provide much better Healthcare at a much lower cost. Get the word out! Will always protect pre-existing conditions!!!
"We will have Healthcare which is FAR BETTER than ObamaCare, at a FAR LOWER COST - BIG PREMIUM REDUCTION. PEOPLE WITH PRE EXISTING CONDITIONS WILL BE PROTECTED AT AN EVEN HIGHER LEVEL THAN NOW. HIGHLY UNPOPULAR AND UNFAIR INDIVIDUAL MANDATE ALREADY TERMINATED. YOU’RE WELCOME!"
"So Crazy to watch Senator Blumenthal of Connecticut lecture all on morals & ethics when for 25 years he said he was a Great War Hero in Vietnam, and he was never even there. He lied & cheated right up until the day he got caught. Thank you to those in military who turned him in!"
STOCK MARKET UP BIG!
"Remember, I wouldn’t be President now had Obama and Biden properly done their job. The fact is, they were TERRIBLE!!!"
"Stock Market Up Big. Do I get no credit for this? Never even mentioned by the Fake News. A New Record for Stocks and Jobs Growth. Remember, “it’s the Economy Stupid”.  VOTE!!!"
"Our Country cannot survive as a Socialist Nation, and that’s what the Democrats want it to be. The USA will never become a large scale version of Venezuela. All control is already being taken away from Sleepy Joe. He has Zero to say!!!"
"The Republicans are giving the Democrats a great deal of time, which is not mandated, to make their self serving statements relative to our great new future Supreme Court Justice. Personally, I would pull back, approve, and go for STIMULUS for the people!!!"
"Illinois has no place to go. Sad, isn’t it? Vote Trump!"
New York has gone to hell. Vote Trump!
California is going to hell. Vote Trump!
He should have been prosecuted for the threats he made to the Justices. Pathetic!
"See you in Sanford, Florida, tonight for a Big Rally. Covered Live on @OANN, @newsmax and @cspan. Enjoy!!!"
Leading by a lot!
Rigged!
No. A Rigged Election!
"The FBI and Law Enforcement must focus their energy on ANTIFA and the Radical Left, those who have spent the summer trying to burn down poorly run Democrat Cities throughout the USA!"
"Big spike in the China Plague in Europe and other places that the Fake News used to hold up as examples of places that are doing well, in order to make the U.S look bad. Be strong and vigilant, it will run its course. Vaccines and cures are coming fast!"
"“56% of registered voters tell Gallup that they are better off than they were 4 years ago (under Obama/Biden), while only 32% said they were worse off.” Highest number on satisfaction yet recorded, by far. mgoodwin@nypost.com... And it will only get better!!! VOTE"
"Turn California around. No more shutdowns, rolling blackouts, forest fires (management), or water rationing (because millions of gallons are stupidly routed out into the Pacific Ocean). VOTE TRUMP!"
See you in FLORIDA tomorrow night. Big Rally!!!
"The Fake News, @CNN, MSDNC, the failing @nytimes, and the rest, are working overtime spewing every lie in the book to make sure they can demean and disparage, at the highest level possible, to try and win an election for a man who is totally unqualified to be your President, S.J."
"They are indeed Dr. Fauci’s own words. We have done a “phenomenal” job, according to certain governors. Many people agree...And now come the Vaccines & Cures, long ahead of projections!"
"Biden evades “Court Packing” question. @FoxNews  Because his puppet masters are willing to destroy the U.S. Supreme Court. Don’t let this, and so many other really bad things, happen. VOTE!"
"People don’t remember the chaos, hatred & discord that we all went through during the 8 years of Obama/Biden. St. Louis, Oakland, Baltimore, and so many other places,  were a complete & total disaster. I wouldn’t be in the beautiful White House if it weren’t for Sleepy Joe, etc."
"Oklahoma, we need @StephanieBice in Congress! She delivers for our Teachers & Students, and she will always protect your #2A & Energy Jobs, unlike her opponent who votes against our Oil & Gas industry. Stephanie has my Complete and Total Endorsement! #OK05"
"Yvette Herrell (@Yvette4Congress) is a proven fighter for New Mexico! She strongly supports our Brave Law Enforcement, Life and the Second Amendment. Strong on the Border and Trade, Yvette has my Complete and Total Endorsement! #NM02"
"We need @NancyMace in Congress to fight for the people of South Carolina! Strong on the Military, Law Enforcement and our Veterans, Nancy has been with me and our America First agenda since the beginning! Nancy has my Complete and Total Endorsement! #SC01"
"We need Tiffany Shedd (@Tiffany_Shedd) in Congress to fight for the people of Arizona! She will be a tremendous ally and advocate for Arizona’s Farmers, the Second Amendment and the Border. Tiffany has my Complete and Total Endorsement! #AZ01"
"Dale Crafts (@DaleCraftsME) will be a tremendous Congressman for Maine! An experienced businessman, Dale knows how to Create Jobs. He loves our Vets & Military and he will always defend your Second Amendment. Dale has my Complete & Total Endorsement! #ME02"
Documents reveal that General Flynn was entrapped! @EveningEdit @FoxNews
".@SteveScully, the Never Trumper next debate moderator, got caught cold. Pulled out the old, “I’ve been hacked”, line. That never works. His bosses are furious at him as he’s lost all credibility!"
Thank you @SenatorDole. So true!
Thank you @SenatorDole. So true!
"Will be in Sanford, Florida on Monday for a very BIG RALLY!"
COLORADO! Your mail ballots are being sent out beginning TODAY! Fill them out and VOTE #TrumpPence2020!
Hello!
"I will save your a Second Amendment, Virginia. He is going to take it away. Vote Trump!"
Nick has my Complete and Total Endorsement. A warrior for Virginia and the USA! Big on protecting your Second Amendment!
Looking forward to speaking with the Great Rush and guests!
Kamala Harris Lied Repeatedly and Got Away With It:
Crazy Nancy is the one who should be under observation. They don’t call her Crazy for nothing!
"2010 to 2016 under Kamala Harris's watch as ""TOP COP.”"
"Moderator cut off @VP Mike Pence while discussing the Knights of Columbus. This is what he was referring to...
“Kamala Harris’s Outrageous Assault on the Knights of Columbus”"
"Obama, Biden, Crooked Hillary and many others got caught in a Treasonous Act of Spying and Government Overthrow, a Criminal Act. How is Biden now allowed to run for President?"
"Biden supports Cory Booker’s Bill that will force low income housing in the Suburbs, which will lower property values and bring crime to your neighborhoods. If Dems win, GOODBYE SUBURBS!"
"My highly regarded Executive Order protected 525,000 American jobs during the height of the Chinese Plague. Democrats want to have Open Borders!"
We should have the small remaining number of our BRAVE Men and Women serving in Afghanistan home by Christmas!
A MESSAGE FROM THE PRESIDENT!
"Just spoke with Prime Minister @BorisJohnson of the United Kingdom. Very thankful for his friendship and support as I recovered from the China Virus. I am looking forward to working with him for many years to come, a great guy!"
"Was just briefed on Hurricane Delta, and spoke with @GovAbbott of Texas and @LouisianaGov John Bel Edwards. Please heed the directions of your State and Local Officials. We are working with them very closely — please be prepared, be careful, and be safe!"
"Wow!!! NOW DO SOMETHING ABOUT THIS, THE BIGGEST OF ALL POLITICAL SCANDALS (IN HISTORY)!!! BIDEN, OBAMA AND CROOKED HILLARY LED THIS TREASONOUS PLOT!!! BIDEN SHOULDN’T BE ALLOWED TO RUN - GOT CAUGHT!!!"
"Early voting and vote-by-mail start TODAY in ARIZONA! Cast your vote early in person, or request your vote-by-mail ballot right now. We want all eligible voters to vote, and have it counted! Request your vote-by-mail ballot by clicking below! #VOTE"
Where are all of the arrests? Can you imagine if the roles were reversed? Long term sentences would have started two years ago. Shameful!
"Wow, what does this grim picture remind you of? I am the only thing in the Radical Left’s way! VOTE"
VOTE TRUMP CALIFORNIA!
Thank you Heather!
True!
"Move Fast, I Am Waiting To Sign! @SpeakerPelosi"
Proud of you Natalie!
We just got a BIG win for the people of Michigan. Open up your Churches and your Schools. Auto companies pouring in and expanding (thank you Mr. President!). Have fun!
Watch clip. Great job South Dakota!
"...And I had to put up with these losers and still run a Country, AND VERY WELL!"
"DEMS WANT TO SHUT YOUR CHURCHES DOWN, PERMANENTLY. HOPE YOU SEE WHAT IS HAPPENING. VOTE NOW!"
"If I am sent a Stand Alone Bill for Stimulus Checks ($1,200), they will go out to our great people IMMEDIATELY. I am ready to sign right now. Are you listening Nancy? @MarkMeadows @senatemajldr @kevinomccarthy @SpeakerPelosi @SenSchumer"
"11,00 North Carolina residents get incorrect voter registration forms. 2000 LA County Voters received “faulty” Ballots, with NO WAY TO VOTE FOR PRESIDENT. Many others throughout USA. Here we go. This will be the most corrupt Election in American History!"
"The House & Senate should IMMEDIATELY Approve 25 Billion Dollars for Airline Payroll Support, & 135 Billion Dollars for Paycheck Protection Program for Small Business. Both of these will be fully paid for with unused funds from the Cares Act. Have this money. I will sign now!"
"Wear your mask in the “beauty” parlor, Nancy!"
"So I had to constantly fight off all of this Scum, achieve more than any other President in First Term, and then they talk Chaos. They created crimes against me and this administration!"
New FDA Rules make it more difficult for them to speed up vaccines for approval before Election Day. Just another political hit job! @SteveFDA
Chris Wallace was a total JOKE. Protected Joe all night long. He’s no Mike!!!
His all time favorite ad. Disgraceful!
Can’t believe these con men are not yet being PROSECUTED. Pathetic!
It will be fast and easy!
Because Mueller and his 18 Angry Democrats were illegally in on the SCAM?
"I have fully authorized the total Declassification of any & all documents pertaining to the single greatest political CRIME in American History, the Russia Hoax. Likewise, the Hillary Clinton Email Scandal. No redactions!"
Republicans need to get smart and confirm Nate Simington to the FCC ASAP! @SenatorWicker Thank you!
"Crazy Nancy Pelosi and the Radical Left Democrats were just playing “games” with the desperately needed Workers Stimulus Payments.They just wanted to take care of Democrat failed, high crime, Cities and States. They were never in it to help the workers, and they never will be!"
True!
"How does Biden lead in Pennsylvania Polls when he is against Fracking (JOBS!), 2nd Amendment and Religion? Fake Polls. I will win Pennsylvania!"
"...also coming back in record numbers. We are leading the World in Economic Recovery, and THE BEST IS YET TO COME!"
"...@senatemajldr Mitch McConnell not to delay, but to instead focus full time on approving my outstanding nominee to the United States Supreme Court, Amy Coney Barrett. Our Economy is doing very well. The Stock Market is at record levels, JOBS and unemployment..."
"...request, and looking to the future of our Country. I have instructed my representatives to stop negotiating until after the election when, immediately after I win, we will pass a major Stimulus Bill that focuses on hardworking Americans and Small Business. I have asked..."
"Nancy Pelosi is asking for $2.4 Trillion Dollars to bailout poorly run, high crime, Democrat States, money that is in no way related to COVID-19. We made a very generous offer of $1.6 Trillion Dollars and, as usual, she is not negotiating in good faith. I am rejecting their..."
"Mini Mike Bloomberg, who made a fool of himself on the Dems debate stage when Elizabeth Warren & the others simply took him apart, is going “crazy” trying to buy his way back into the Liberal Democrat’s hearts. His Florida ads are lies. I am much better for SENIORS than Sleepy!"
NEW MEXICO! Today is the last day you can register to vote online or via mail. Make sure your vote counts!
"I am looking forward to the debate on the evening of Thursday, October 15th in Miami. It will be great!"
FEELING GREAT!
"Biden and Democrats just clarified the fact that they are fully in favor of (very) LATE TERM ABORTION, right up until the time of birth, and beyond - which would be execution. Biden even endorsed the Governor of Virginia, who stated this clearly for all to hear. GET OUT & VOTE!!!"
Wow. Joe Biden just took a more Liberal position on Roe v. Wade than Elizabeth Warren at her highest. He also wants to PACK our great United States Supreme Court. This is what the Dems will do. Remember as they try changing positions before elections end. GET OUT AND VOTE!
Wow. Joe Biden just took a more Liberal position on Roe v. Wade than Elizabeth Warren at her highest. He also wants to PACK our great United States Supreme Court. This is what the Dems will do. Remember as they try changing positions before elections end. GET OUT AND VOTE!
Wow. Joe Biden just took a more Liberal position on Roe v. Wade than Elizabeth Warren at her highest. He also wants to PACK our great United States Supreme Court. This is what the Dems will do. Remember as they try changing positions before elections end. GET OUT AND VOTE!
"....invincible hero, who not only survived every dirty trick the Democrats threw at him, but the Chinese virus as well. He will show America we no longer have to be afraid.” @MirandaDevine @NYPost  Thank you Miranda. Was over until the Plague came in from China. Will win anyway!"
"“You see it in enthusiasm for the President outside Walter Reed Hospital. You see it in Registrations, from Florida to Pennsylvania & West Virginia, where Republicans are outstripping Democrats by 2 to 1. If the President bounces back onto the campaign trail, he will be an...."
Will be back on the Campaign Trail soon!!! The Fake News only shows the Fake Polls.
"STOCK MARKET UP BIG, 466 Points!  28,149. Great News for America. Jobs, Jobs, Jobs!"
"I will be leaving the great Walter Reed Medical Center today at 6:30 P.M. Feeling really good! Don’t be afraid of Covid. Don’t let it dominate your life. We have developed, under the Trump Administration, some really great drugs & knowledge. I feel better than I did 20 years ago!"
"It is reported that the Media is upset because I got into a secure vehicle to say thank you to the many fans and supporters who were standing outside of the hospital for many hours, and even days, to pay their respect to their President. If I didn’t do it, Media would say RUDE!!!"
"TODAY is the LAST day to register to VOTE in ARIZONA, FLORIDA, GEORGIA, OHIO, AND TEXAS! Click below for more information, and let’s #MAGA!"
PEACE THROUGH STRENGTH (BRING OUR SOLDIERS HOME). VOTE!
SAVE OUR SECOND AMENDMENT. VOTE!
FIGHT THE CORRUPT FAKE NEWS MEDIA. VOTE!
PROTECT PREEXISTING CONDITIONS. VOTE!
BETTER & CHEAPER HEALTHCARE. VOTE!
PRO LIFE! VOTE!
MASSIVE REGULATION CUTS. VOTE!
SPACE FORCE. VOTE!
BEST V.A. EVER. 91% APPROVAL RATING. VOTE!
"BIGGEST TAX CUT EVER, AND ANOTHER ONE COMING. VOTE!"
RELIGIOUS LIBERTY. VOTE!
LAW & ORDER. VOTE!
STRONGEST EVER MILITARY. VOTE!
STOCK MARKET HIGHS. VOTE!
"Virginia Voters! Your Governor wants to obliterate your Second Amendment. I have stopped him. I am the only thing between you and your Second Amendment. Working hard in Virginia. It’s IN PLAY. Better Vote for your favorite President, or wave goodbye to low taxes and gun rights!"
"IF YOU WANT A MASSIVE TAX INCREASE, THE BIGGEST IN THE HISTORY OF OUR COUNTRY (AND ONE THAT WILL SHUT OUR ECONOMY AND JOBS DOWN), VOTE DEMOCRAT!!!"
"“I’m voting for Donald Trump. My father is a Union Worker and his 401K has tripled under President Trump.” USA Voter. @foxandfriends  Thank you, and remember that the Stock Market is getting ready to break its all time high. NEXT YEAR WILL BE THE BEST EVER. VOTE, VOTE, VOTE!!!!!"
Thank you so much!
OUR GREAT USA WANTS & NEEDS STIMULUS. WORK TOGETHER AND GET IT DONE. Thank you!
"Doctors, Nurses and ALL at the GREAT Walter Reed Medical Center, and others from likewise incredible institutions who have joined them, are AMAZING!!!Tremendous progress has been made over the last 6 months in fighting this PLAGUE. With their help, I am feeling well!"
"Going welI, I think! Thank you to all. LOVE!!!"
"Going welI, I think! Thank you to all. LOVE!!!"
"Tonight, @FLOTUS and I tested positive for COVID-19. We will begin our quarantine and recovery process immediately. We will get through this TOGETHER!"
"Hope Hicks, who has been working so hard without even taking a small break, has just tested positive for Covid 19. Terrible! The First Lady and I are waiting for our test results. In the meantime, we will begin our quarantine process!"
I will be overturning this ridiculous order immediately!
"100,000 DEFECTIVE BALLOTS IN NEW YORK. THEY WANT TO REPLACE THEM, BUT WHERE, AND WHAT HAPPENS TO, THE BALLOTS THAT WERE FIRST SENT? THEY WILL BE USED BY SOMEBODY. USA, END THIS SCAM - GO OUT AND VOTE!"
"In just 3 and a half years, we have secured America’s Borders, rebuilt the awesome power of the U.S. Military, obliterated the ISIS caliphate, fixed our disastrous Trade Deals, and brought JOBS back home to America – and back to MINNESOTA! #MAGA"
"As VP, Biden wiped out the Iron Range – seven plants were idled and more than 2K workers were laid off. After I put Tariffs on foreign steel, the Iron Range came roaring back to life! If Joe gets in, the Radical Left will shut down the Iron Range FOREVER!"
I want to defend & preserve our nation’s historic values. Our opponents stand with rioters – I stand with the heroes of Law Enforcement. Biden says Antifa is just an idea. Ideas don’t assault cops & burn down buildings. Antifa is a domestic terrorist org.
Comey is a disaster who cheated and lied. How do you write books when you can’t remember anything? Should be tried for treason. This is ridiculous!
"Last night I did what the corrupt media has refused to do: I held Joe Biden Accountable for his 47 years of lies, 47 years of betrayals, and 47 years of failure. The whole nation saw the truth — Joe Biden is too weak to lead this Country!"
Just departed the White House for Minnesota! #MAGA
Radical Left Democrats are going CRAZY!
Such a timid group of reporters at the Biden Press Conference. Where do these people come from?
"Many more people would have died from the China Virus if Sleepy Joe were your President. He didn’t even want me to close our Country to Infected China until TWO MONTHS  later, when he said I was right. Now he likes to say I didn’t close up “fast enough”. Just another politician!"
Heading to Minnesota today. Saved Minneapolis after the Dem LEFT almost let it be TOTALLY destroyed! #MAGA
"Wow! 100,000 Mail In Ballots in New York City a total MESS. Mayor and Governor have no idea what to do. Big Fraud, Unfixable! Cancel Ballots and go out and VOTE, just like in past decades, when there were no problems!"
"Biden REFUSED to use the term, LAW & ORDER! There go the Suburbs."
The American people want LAW & ORDER — Joe Biden won’t even say those words!
"“The Fraternal Order of Police endorsed President Trump’s reelection, saying he has the ‘full and enthusiastic support’ of its more than 355,000 members.”"
"Joe Biden on Judge Amy Coney Barrett: ""I’m not opposed to the justice.""
#Debates2020"
When Joe Biden was VP...
Wow. Won’t let Poll Watchers & Security into Philadelphia Voting Places. There is only one reason why. Corruption!!! Must have a fair Election.
"Just arrived in the Great State of Ohio. Real Polls have us leading by even more than 2016. With Biden being against Fracking (Energy & Jobs) & your Second Amendment, we should be in very good shape!"
"Now Fake News @CNN is actually reporting that I wanted my daughter, Ivanka, to run with me as my Vice President in 2016 Election. Wrong and totally ridiculous. These people are sick!"
Might as well mention this because it will never be reported by the Lamestream Media!
Might as well mention this because it will never be reported by the Lamestream Media!
The “Trump Doctrine” earns President Trump a third Nobel Peace Prize Nomination! @LouDobbs
"Joe Biden just announced that he will not agree to a Drug Test. Gee, I wonder why?"
".....Financial Statements, from  the time I announced I was going to run for President,  showing all properties, assets and debts. It is a very IMPRESSIVE Statement, and also shows that I am the only President on record to give up my yearly $400,000 plus Presidential Salary!"
".....Also, if you look at the extraordinary assets owned by me, which the Fake News hasn’t, I am extremely under leveraged - I have very little debt compared to the value of assets. Much of this information is already on file, but I have long said that I may release...."
"The Fake News Media, just like Election time 2016, is bringing up my Taxes & all sorts of other nonsense with illegally obtained information & only bad intent. I paid many millions of dollars in taxes but was entitled, like everyone else, to depreciation & tax credits....."
The Ballots being returned to States cannot be accurately counted. Many things are already going very wrong!
"Obamacare will be replaced with a MUCH better, and FAR cheaper, alternative if it is terminated in the Supreme Court. Would be a big WIN for the USA!"
WATCH THE BALLOTS!!!
"Wow, nobody realized how far Mini Mike Bloomberg went in bribing ex-prisoners to go out and vote for Sleepy Joe. He is desperate to get back into the good graces of the people who not only badly beat him, but made him look like a total fool. Now he’s committed a serious crime!"
"YES, for many years, and hundreds of times a year. He is a Senatorial JOKE!"
"Hanoi Dick, who lied for years by saying he was a war hero in Vietnam, and was never even there (Impeach him!), should not be entitled to a vote on anything of importance!"
"I will be strongly demanding a Drug Test of Sleepy Joe Biden prior to, or after, the Debate on Tuesday night. Naturally, I will agree to take one also. His Debate performances have been record setting UNEVEN, to put it mildly. Only drugs could have caused this discrepancy???"
"For years you had a President who apologized for America - now you have a President who is standing up for America, and standing up for Pennsylvania. So get your friends, get your family, get your neighbors & co-workers, and GET OUT & VOTE! Early voting has already begun — VOTE!"
"Together, we are taking back our Country. We are returning power to YOU, the American People. With your help, your devotion, & your drive, we are going to keep on working, we are going to keep on fighting, & we are going to keep ON WINNING! Get out & VOTE! http://Vote.DonaldJTrump.com"
"In just 3 and a half years, we have secured America’s Borders, rebuilt the awesome power of the U.S. Military, obliterated the ISIS caliphate, fixed our disastrous Trade Deals, and brought JOBS back home to America – and back to PENNSYLVANIA! #MAGA"
THANK YOU PENNSYLVANIA!
A great Scam against our Country!
Great!
"Governor Andrew Cuomo of New York wants to put New York at the END of the Vaccine List in that he doesn’t trust the @FDA or Federal Government, even though the Vaccines are being developed by the finest Labs in the World. Wish he trusted us on Nursing Homes!"
BIG NEWS! The @Smithsonian American History Museum reopened today in our Nation’s Capital! Go visit @amhistorymuseum and learn about our GREAT Country’s history!
