"I was honored to be back in Georgia with a truly incredible organization—BLACK VOICES FOR TRUMP, where I announced a brand new plan to deliver more opportunity, more security, more fairness, and more prosperity to black communities. #ThePlatinumPlan"
"Just landed in Atlanta, Georgia. On my way now, see everyone shortly!"
"RINO Governor Charlie Baker of Massachusetts is unsuccessfully trying to defend Mail In Ballots, when there is fraud being found all over the place. Just look at some of the recent races, or the Trump Ballots in Pennsylvania that were thrown into the garbage. Wrong Charlie!"
Working hard in New Mexico. I built the Wall (security) and will totally protect your Second Amendment (The Dems want to obliterate it!). Will be there soon!
The FINAL PILLAR of the America First Healthcare Plan—better care! The historic action I took today includes the first-ever executive order to affirm it is the official policy of the United States Government to protect patients with pre-existing conditions.
"The SECOND PILLAR of the America First Healthcare Plan will lower costs for families and seniors. The days of ripping off American patients are over. Today, I signed an historic executive order that ENDS surprise medical billing."
The FIRST PILLAR of the America First Healthcare Plan—more CHOICE for American Patients!
The FIRST PILLAR of the America First Healthcare Plan—more CHOICE for American Patients!
"Under The America First Healthcare Plan, we will ensure the highest standard of care anywhere in the world — cutting-edge treatments, state-of-the-art medicine, groundbreaking cures, and true health security for you and your loved ones!"
We will always protect patients with pre-existing conditions!
"It was great to be back in North Carolina delivering The America First Healthcare Plan! We will provide MORE CHOICES, LOWER COSTS, and BETTER CARE!"
"Rasmussen Approval Rating: 52%. Republican Party Approval Rating, 95%. Thank you!"
Florida looking good!
LAW & ORDER!
"Praying for the two police officers that were shot tonight in Louisville, Kentucky. The Federal Government stands behind you and is ready to help. Spoke to @GovAndyBeshear and we are prepared to work together, immediately upon request!"
"Praying for the two police officers that were shot tonight in Louisville, Kentucky. The Federal Government stands behind you and is ready to help. Spoke to @GovAndyBeshear and we are prepared to work together, immediately upon request!"
"Congressman Greg Gianforte (@GregForMontana) will be a tremendous Governor of Montana! A successful Businessman, he will Cut your Taxes, Defend your #2A, and protect Montana’s Beautiful Public Lands. Greg has my Complete and Total Endorsement! #MTGOV"
"Diana Harshbarger (@DHarshbargerTN1) will be a champion in Congress for the People of Tennessee! She is Strong on Immigration, Jobs, Life and the Second Amendment. Diana has my Complete and Total Endorsement! #TN01"
"Scott Fitzgerald (@FitzgeraldForWI) will be a tremendous Congressman for the State of Wisconsin! He is Strong on Jobs and Life, wants to Lower Your Taxes, and he will always Defend your Second Amendment. Scott has my Complete and Total Endorsement! #WI05"
".@RandyFeenstra will be an outstanding Congressman for the State of Iowa! He will Fight for our Farmers, help us Build the Wall, and Defend your Second Amendment. Randy has my Complete and Total Endorsement! #IA04"
"Very important that, in order to watch that ALL are following the Rules & Regulations, you become an Election Official at your local Polling Place. Go sign up NOW!!!"
"Wow, big news. Pick it up Lamestream Media, and pick it up BIG!"